title,description,director,year,actors,categories
Guardians of the Galaxy,"title: Guardians of the Galaxy ,Description: A group of intergalactic criminals are forced to work together to stop a fanatical warrior from taking control of the universe.",James Gunn,2014,"['chris pratt', ' vin diesel', ' bradley cooper', ' zoe saldana']","['action', 'adventure', 'sci-fi']"
Prometheus,"title: Prometheus ,Description: Following clues to the origin of mankind, a team finds a structure on a distant moon, but they soon realize they are not alone.",Ridley Scott,2012,"['noomi rapace', ' logan marshall-green', ' michael fassbender', ' charlize theron']","['adventure', 'mystery', 'sci-fi']"
Split,"title: Split ,Description: Three girls are kidnapped by a man with a diagnosed 23 distinct personalities. They must try to escape before the apparent emergence of a frightful new 24th.",M. Night Shyamalan,2016,"['james mcavoy', ' anya taylor-joy', ' haley lu richardson', ' jessica sula']","['horror', 'thriller']"
Sing,"title: Sing ,Description: In a city of humanoid animals, a hustling theater impresario's attempt to save his theater with a singing competition becomes grander than he anticipates even as its finalists' find that their lives will never be the same.",Christophe Lourdelet,2016,"['matthew mcconaughey', 'reese witherspoon', ' seth macfarlane', ' scarlett johansson']","['animation', 'comedy', 'family']"
Suicide Squad,"title: Suicide Squad ,Description: A secret government agency recruits some of the most dangerous incarcerated super-villains to form a defensive task force. Their first mission: save the world from the apocalypse.",David Ayer,2016,"['will smith', ' jared leto', ' margot robbie', ' viola davis']","['action', 'adventure', 'fantasy']"
The Great Wall,"title: The Great Wall ,Description: European mercenaries searching for black powder become embroiled in the defense of the Great Wall of China against a horde of monstrous creatures.",Yimou Zhang,2016,"['matt damon', ' tian jing', ' willem dafoe', ' andy lau']","['action', 'adventure', 'fantasy']"
La La Land,"title: La La Land ,Description: A jazz pianist falls for an aspiring actress in Los Angeles.",Damien Chazelle,2016,"['ryan gosling', ' emma stone', ' rosemarie dewitt', ' j.k. simmons']","['comedy', 'drama', 'music']"
Mindhorn,"title: Mindhorn ,Description: A has-been actor best known for playing the title character in the 1980s detective series ""Mindhorn"" must work with the police when a serial killer says that he will only speak with Detective Mindhorn, whom he believes to be a real person.",Sean Foley,2016,"['essie davis', ' andrea riseborough', ' julian barratt', 'kenneth branagh']",['comedy']
The Lost City of Z,"title: The Lost City of Z ,Description: A true-life drama, centering on British explorer Col. Percival Fawcett, who disappeared while searching for a mysterious city in the Amazon in the 1920s.",James Gray,2016,"['charlie hunnam', ' robert pattinson', ' sienna miller', ' tom holland']","['action', 'adventure', 'biography']"
Passengers,"title: Passengers ,Description: A spacecraft traveling to a distant colony planet and transporting thousands of people has a malfunction in its sleep chambers. As a result, two passengers are awakened 90 years early.",Morten Tyldum,2016,"['jennifer lawrence', ' chris pratt', ' michael sheen', 'laurence fishburne']","['adventure', 'drama', 'romance']"
Fantastic Beasts and Where to Find Them,"title: Fantastic Beasts and Where to Find Them ,Description: The adventures of writer Newt Scamander in New York's secret community of witches and wizards seventy years before Harry Potter reads his book in school.",David Yates,2016,"['eddie redmayne', ' katherine waterston', ' alison sudol', 'dan fogler']","['adventure', 'family', 'fantasy']"
Hidden Figures,"title: Hidden Figures ,Description: The story of a team of female African-American mathematicians who served a vital role in NASA during the early years of the U.S. space program.",Theodore Melfi,2016,"['taraji p. henson', ' octavia spencer', ' janelle monáe', 'kevin costner']","['biography', 'drama', 'history']"
Rogue One,"title: Rogue One ,Description: The Rebel Alliance makes a risky move to steal the plans for the Death Star, setting up the epic saga to follow.",Gareth Edwards,2016,"['felicity jones', ' diego luna', ' alan tudyk', ' donnie yen']","['action', 'adventure', 'sci-fi']"
Moana,"title: Moana ,Description: In Ancient Polynesia, when a terrible curse incurred by the Demigod Maui reaches an impetuous Chieftain's daughter's island, she answers the Ocean's call to seek out the Demigod to set things right.",Ron Clements,2016,"['aulii cravalho', ' dwayne johnson', ' rachel house', ' temuera morrison']","['animation', 'adventure', 'comedy']"
Colossal,"title: Colossal ,Description: Gloria is an out-of-work party girl forced to leave her life in New York City, and move back home. When reports surface that a giant creature is destroying Seoul, she gradually comes to the realization that she is somehow connected to this phenomenon.",Nacho Vigalondo,2016,"['anne hathaway', ' jason sudeikis', ' austin stowell', 'tim blake nelson']","['action', 'comedy', 'drama']"
The Secret Life of Pets,"title: The Secret Life of Pets ,Description: The quiet life of a terrier named Max is upended when his owner takes in Duke, a stray whom Max instantly dislikes.",Chris Renaud,2016,"['louis c.k.', ' eric stonestreet', ' kevin hart', ' lake bell']","['animation', 'adventure', 'comedy']"
Hacksaw Ridge,"title: Hacksaw Ridge ,Description: WWII American Army Medic Desmond T. Doss, who served during the Battle of Okinawa, refuses to kill people, and becomes the first man in American history to receive the Medal of Honor without firing a shot.",Mel Gibson,2016,"['andrew garfield', ' sam worthington', ' luke bracey', 'teresa palmer']","['biography', 'drama', 'history']"
Jason Bourne,"title: Jason Bourne ,Description: The CIA's most dangerous former operative is drawn out of hiding to uncover more explosive truths about his past.",Paul Greengrass,2016,"['matt damon', ' tommy lee jones', ' alicia vikander', 'vincent cassel']","['action', 'thriller']"
Lion,"title: Lion ,Description: A five-year-old Indian boy gets lost on the streets of Calcutta, thousands of kilometers from home. He survives many challenges before being adopted by a couple in Australia. 25 years later, he sets out to find his lost family.",Garth Davis,2016,"['dev patel', ' nicole kidman', ' rooney mara', ' sunny pawar']","['biography', 'drama']"
Arrival,"title: Arrival ,Description: When twelve mysterious spacecraft appear around the world, linguistics professor Louise Banks is tasked with interpreting the language of the apparent alien visitors.",Denis Villeneuve,2016,"['amy adams', ' jeremy renner', ' forest whitaker', 'michael stuhlbarg']","['drama', 'mystery', 'sci-fi']"
Gold,"title: Gold ,Description: Kenny Wells, a prospector desperate for a lucky break, teams up with a similarly eager geologist and sets off on a journey to find gold in the uncharted jungle of Indonesia.",Stephen Gaghan,2016,"['matthew mcconaughey', ' edgar ramírez', ' bryce dallas howard', ' corey stoll']","['adventure', 'drama', 'thriller']"
Manchester by the Sea,"title: Manchester by the Sea ,Description: A depressed uncle is asked to take care of his teenage nephew after the boy's father dies.",Kenneth Lonergan,2016,"['casey affleck', ' michelle williams', ' kyle chandler', 'lucas hedges']",['drama']
Hounds of Love,"title: Hounds of Love ,Description: A cold-blooded predatory couple while cruising the streets in search of their next victim, will stumble upon a 17-year-old high school girl, who will be sedated, abducted and chained in the strangers' guest room.",Ben Young,2016,"['emma booth', ' ashleigh cummings', ' stephen curry', 'susie porter']","['crime', 'drama', 'horror']"
Trolls,"title: Trolls ,Description: After the Bergens invade Troll Village, Poppy, the happiest Troll ever born, and the curmudgeonly Branch set off on a journey to rescue her friends.",Walt Dohrn,2016,"['anna kendrick', ' justin timberlake', 'zooey deschanel', ' christopher mintz-plasse']","['animation', 'adventure', 'comedy']"
Independence Day: Resurgence,"title: Independence Day: Resurgence ,Description: Two decades after the first Independence Day invasion, Earth is faced with a new extra-Solar threat. But will mankind's new space defenses be enough?",Roland Emmerich,2016,"['liam hemsworth', ' jeff goldblum', ' bill pullman', 'maika monroe']","['action', 'adventure', 'sci-fi']"
Paris pieds nus,"title: Paris pieds nus ,Description: Fiona visits Paris for the first time to assist her myopic Aunt Martha. Catastrophes ensue, mainly involving Dom, a homeless man who has yet to have an emotion or thought he was afraid of expressing.",Dominique Abel,2016,"['fiona gordon', ' dominique abel', 'emmanuelle riva', ' pierre richard']",['comedy']
Bahubali: The Beginning,"title: Bahubali: The Beginning ,Description: In ancient India, an adventurous and daring man becomes involved in a decades old feud between two warring people.",S.S. Rajamouli,2015,"['prabhas', ' rana daggubati', ' anushka shetty', 'tamannaah bhatia']","['action', 'adventure', 'drama']"
Dead Awake,"title: Dead Awake ,Description: A young woman must save herself and her friends from an ancient evil that stalks its victims through the real-life phenomenon of sleep paralysis.",Phillip Guzman,2016,"['jocelin donahue', ' jesse bradford', ' jesse borrego', 'lori petty']","['horror', 'thriller']"
Bad Moms,"title: Bad Moms ,Description: When three overworked and under-appreciated moms are pushed beyond their limits, they ditch their conventional responsibilities for a jolt of long overdue freedom, fun, and comedic self-indulgence.",Jon Lucas,2016,"['mila kunis', ' kathryn hahn', ' kristen bell', 'christina applegate']",['comedy']
Assassin's Creed,"title: Assassin's Creed ,Description: When Callum Lynch explores the memories of his ancestor Aguilar and gains the skills of a Master Assassin, he discovers he is a descendant of the secret Assassins society.",Justin Kurzel,2016,"['michael fassbender', ' marion cotillard', ' jeremy irons', 'brendan gleeson']","['action', 'adventure', 'drama']"
Why Him?,"title: Why Him? ,Description: A holiday gathering threatens to go off the rails when Ned Fleming realizes that his daughter's Silicon Valley millionaire boyfriend is about to pop the question.",John Hamburg,2016,"['zoey deutch', ' james franco', ' tangie ambrose', 'cedric the entertainer']",['comedy']
Nocturnal Animals,"title: Nocturnal Animals ,Description: A wealthy art gallery owner is haunted by her ex-husband's novel, a violent thriller she interprets as a symbolic revenge tale.",Tom Ford,2016,"['amy adams', ' jake gyllenhaal', ' michael shannon', ' aaron taylor-johnson']","['drama', 'thriller']"
X-Men: Apocalypse,"title: X-Men: Apocalypse ,Description: After the re-emergence of the world's first mutant, world-destroyer Apocalypse, the X-Men must unite to defeat his extinction level plan.",Bryan Singer,2016,"['james mcavoy', ' michael fassbender', ' jennifer lawrence', ' nicholas hoult']","['action', 'adventure', 'sci-fi']"
Deadpool,"title: Deadpool ,Description: A fast-talking mercenary with a morbid sense of humor is subjected to a rogue experiment that leaves him with accelerated healing powers and a quest for revenge.",Tim Miller,2016,"['ryan reynolds', ' morena baccarin', ' t.j. miller', ' ed skrein']","['action', 'adventure', 'comedy']"
Resident Evil: The Final Chapter,"title: Resident Evil: The Final Chapter ,Description: Alice returns to where the nightmare began: The Hive in Raccoon City, where the Umbrella Corporation is gathering its forces for a final strike against the only remaining survivors of the apocalypse.",Paul W.S. Anderson,2016,"['milla jovovich', ' iain glen', ' ali larter', ' shawn roberts']","['action', 'horror', 'sci-fi']"
Captain America: Civil War,"title: Captain America: Civil War ,Description: Political interference in the Avengers' activities causes a rift between former allies Captain America and Iron Man.",Anthony Russo,2016,"['chris evans', ' robert downey jr.', 'scarlett johansson', ' sebastian stan']","['action', 'adventure', 'sci-fi']"
Interstellar,"title: Interstellar ,Description: A team of explorers travel through a wormhole in space in an attempt to ensure humanity's survival.",Christopher Nolan,2014,"['matthew mcconaughey', ' anne hathaway', ' jessica chastain', ' mackenzie foy']","['adventure', 'drama', 'sci-fi']"
Doctor Strange,"title: Doctor Strange ,Description: While on a journey of physical and spiritual healing, a brilliant neurosurgeon is drawn into the world of the mystic arts.",Scott Derrickson,2016,"['benedict cumberbatch', ' chiwetel ejiofor', ' rachel mcadams', ' benedict wong']","['action', 'adventure', 'fantasy']"
The Magnificent Seven,"title: The Magnificent Seven ,Description: Seven gunmen in the old west gradually come together to help a poor village against savage thieves.",Antoine Fuqua,2016,"['denzel washington', ' chris pratt', ' ethan hawke', 'vincent donofrio']","['action', 'adventure', 'western']"
5/25/1977,"title: 5/25/1977 ,Description: Alienated, hopeful-filmmaker Pat Johnson's epic story growing up in rural Illinois, falling in love, and becoming the first fan of the movie that changed everything.",Patrick Read Johnson,2007,"['john francis daley', ' austin pendleton', ' colleen camp', ' neil flynn']","['comedy', 'drama']"
Sausage Party,"title: Sausage Party ,Description: A sausage strives to discover the truth about his existence.",Greg Tiernan,2016,"['seth rogen', ' kristen wiig', ' jonah hill', ' alistair abell']","['animation', 'adventure', 'comedy']"
Moonlight,"title: Moonlight ,Description: A chronicle of the childhood, adolescence and burgeoning adulthood of a young, African-American, gay man growing up in a rough neighborhood of Miami.",Barry Jenkins,2016,"['mahershala ali', ' shariff earp', ' duan sanderson', ' alex r. hibbert']",['drama']
Don't Fuck in the Woods,"title: Don't Fuck in the Woods ,Description: A group of friends are going on a camping trip to celebrate graduating college. But once they enter the woods, the proverbial shit starts to hit the fan.",Shawn Burkett,2016,"['brittany blanton', ' ayse howard', ' roman jossart', 'nadia white']",['horror']
The Founder,"title: The Founder ,Description: The story of Ray Kroc, a salesman who turned two brothers' innovative fast food eatery, McDonald's, into one of the biggest restaurant businesses in the world with a combination of ambition, persistence, and ruthlessness.",John Lee Hancock,2016,"['michael keaton', ' nick offerman', ' john carroll lynch', ' linda cardellini']","['biography', 'drama', 'history']"
Lowriders,"title: Lowriders ,Description: A young street artist in East Los Angeles is caught between his father's obsession with lowrider car culture, his ex-felon brother and his need for self-expression.",Ricardo de Montreuil,2016,"['gabriel chavarria', ' demián bichir', ' theo rossi', 'tony revolori']",['drama']
Pirates of the Caribbean: On Stranger Tides,"title: Pirates of the Caribbean: On Stranger Tides ,Description: Jack Sparrow and Barbossa embark on a quest to find the elusive fountain of youth, only to discover that Blackbeard and his daughter are after it too.",Rob Marshall,2011,"['johnny depp', ' penélope cruz', ' ian mcshane', ' geoffrey rush']","['action', 'adventure', 'fantasy']"
Miss Sloane,"title: Miss Sloane ,Description: In the high-stakes world of political power-brokers, Elizabeth Sloane is the most sought after and formidable lobbyist in D.C. But when taking on the most powerful opponent of her career, she finds winning may come at too high a price.",John Madden,2016,"['jessica chastain', ' mark strong', ' gugu mbatha-raw', 'michael stuhlbarg']","['drama', 'thriller']"
Fallen,"title: Fallen ,Description: A young girl finds herself in a reform school after therapy since she was blamed for the death of a young boy. At the school she finds herself drawn to a fellow student, unaware that he is an angel, and has loved her for thousands of years.",Scott Hicks,2016,"['hermione corfield', ' addison timlin', ' joely richardson', 'jeremy irvine']","['adventure', 'drama', 'fantasy']"
Star Trek Beyond,"title: Star Trek Beyond ,Description: The USS Enterprise crew explores the furthest reaches of uncharted space, where they encounter a new ruthless enemy who puts them and everything the Federation stands for to the test.",Justin Lin,2016,"['chris pine', ' zachary quinto', ' karl urban', ' zoe saldana']","['action', 'adventure', 'sci-fi']"
The Last Face,"title: The Last Face ,Description: A director (Charlize Theron) of an international aid agency in Africa meets a relief aid doctor (Javier Bardem) amidst a political/social revolution, and together face tough choices ... See full summary »",Sean Penn,2016,"['charlize theron', ' javier bardem', ' adèle exarchopoulos', 'jared harris']",['drama']
Star Wars: Episode VII - The Force Awakens,"title: Star Wars: Episode VII - The Force Awakens ,Description: Three decades after the defeat of the Galactic Empire, a new threat arises. The First Order attempts to rule the galaxy and only a ragtag group of heroes can stop them, along with the help of the Resistance.",J.J. Abrams,2015,"['daisy ridley', ' john boyega', ' oscar isaac', ' domhnall gleeson']","['action', 'adventure', 'fantasy']"
Underworld: Blood Wars,"title: Underworld: Blood Wars ,Description: Vampire death dealer, Selene (Kate Beckinsale) fights to end the eternal war between the Lycan clan and the Vampire faction that betrayed her.",Anna Foerster,2016,"['kate beckinsale', ' theo james', ' tobias menzies', ' lara pulver']","['action', 'adventure', 'fantasy']"
Mother's Day,"title: Mother's Day ,Description: Three generations come together in the week leading up to Mother's Day.",Garry Marshall,2016,"['jennifer aniston', ' kate hudson', ' julia roberts', ' jason sudeikis']","['comedy', 'drama']"
John Wick,"title: John Wick ,Description: An ex-hitman comes out of retirement to track down the gangsters that took everything from him.",Chad Stahelski,2014,"['keanu reeves', ' michael nyqvist', ' alfie allen', ' willem dafoe']","['action', 'crime', 'thriller']"
The Dark Knight,"title: The Dark Knight ,Description: When the menace known as the Joker wreaks havoc and chaos on the people of Gotham, the Dark Knight must come to terms with one of the greatest psychological tests of his ability to fight injustice.",Christopher Nolan,2008,"['christian bale', ' heath ledger', ' aaron eckhart', 'michael caine']","['action', 'crime', 'drama']"
Silence,"title: Silence ,Description: In the 17th century, two Portuguese Jesuit priests travel to Japan in an attempt to locate their mentor, who is rumored to have committed apostasy, and to propagate Catholicism.",Martin Scorsese,2016,"['andrew garfield', ' adam driver', ' liam neeson', 'tadanobu asano']","['adventure', 'drama', 'history']"
Don't Breathe,"title: Don't Breathe ,Description: Hoping to walk away with a massive fortune, a trio of thieves break into the house of a blind man who isn't as helpless as he seems.",Fede Alvarez,2016,"['stephen lang', ' jane levy', ' dylan minnette', ' daniel zovatto']","['crime', 'horror', 'thriller']"
Me Before You,"title: Me Before You ,Description: A girl in a small town forms an unlikely bond with a recently-paralyzed man she's taking care of.",Thea Sharrock,2016,"['emilia clarke', ' sam claflin', ' janet mcteer', ' charles dance']","['drama', 'romance']"
Their Finest,"title: Their Finest ,Description: A former secretary, newly appointed as a scriptwriter for propaganda films, joins the cast and crew of a major production while the Blitz rages around them.",Lone Scherfig,2016,"['gemma arterton', ' sam claflin', ' bill nighy', ' jack huston']","['comedy', 'drama', 'romance']"
Sully,"title: Sully ,Description: The story of Chesley Sullenberger, an American pilot who became a hero after landing his damaged plane on the Hudson River in order to save the flight's passengers and crew.",Clint Eastwood,2016,"['tom hanks', ' aaron eckhart', ' laura linney', ' valerie mahaffey']","['biography', 'drama']"
Batman v Superman: Dawn of Justice,"title: Batman v Superman: Dawn of Justice ,Description: Fearing that the actions of Superman are left unchecked, Batman takes on the Man of Steel, while the world wrestles with what kind of a hero it really needs.",Zack Snyder,2016,"['ben affleck', ' henry cavill', ' amy adams', ' jesse eisenberg']","['action', 'adventure', 'sci-fi']"
The Autopsy of Jane Doe,"title: The Autopsy of Jane Doe ,Description: A father and son, both coroners, are pulled into a complex mystery while attempting to identify the body of a young woman, who was apparently harboring dark secrets.",André Øvredal,2016,"['brian cox', ' emile hirsch', ' ophelia lovibond', ' michael mcelhatton']","['horror', 'mystery', 'thriller']"
The Girl on the Train,"title: The Girl on the Train ,Description: A divorcee becomes entangled in a missing persons investigation that promises to send shockwaves throughout her life.",Tate Taylor,2016,"['emily blunt', ' haley bennett', ' rebecca ferguson', ' justin theroux']","['crime', 'drama', 'mystery']"
Fifty Shades of Grey,"title: Fifty Shades of Grey ,Description: Literature student Anastasia Steele's life changes forever when she meets handsome, yet tormented, billionaire Christian Grey.",Sam Taylor-Johnson,2015,"['dakota johnson', ' jamie dornan', ' jennifer ehle', 'eloise mumford']","['drama', 'romance', 'thriller']"
The Prestige,"title: The Prestige ,Description: Two stage magicians engage in competitive one-upmanship in an attempt to create the ultimate stage illusion.",Christopher Nolan,2006,"['christian bale', ' hugh jackman', ' scarlett johansson', ' michael caine']","['drama', 'mystery', 'sci-fi']"
Kingsman: The Secret Service,"title: Kingsman: The Secret Service ,Description: A spy organization recruits an unrefined, but promising street kid into the agency's ultra-competitive training program, just as a global threat emerges from a twisted tech genius.",Matthew Vaughn,2014,"['colin firth', ' taron egerton', ' samuel l. jackson', 'michael caine']","['action', 'adventure', 'comedy']"
Patriots Day,"title: Patriots Day ,Description: The story of the 2013 Boston Marathon bombing and the aftermath, which includes the city-wide manhunt to find the terrorists responsible.",Peter Berg,2016,"['mark wahlberg', ' michelle monaghan', ' j.k. simmons', ' john goodman']","['drama', 'history', 'thriller']"
Mad Max: Fury Road,"title: Mad Max: Fury Road ,Description: A woman rebels against a tyrannical ruler in postapocalyptic Australia in search for her home-land with the help of a group of female prisoners, a psychotic worshipper, and a drifter named Max.",George Miller,2015,"['tom hardy', ' charlize theron', ' nicholas hoult', ' zoë kravitz']","['action', 'adventure', 'sci-fi']"
Wakefield,"title: Wakefield ,Description: A man's nervous breakdown causes him to leave his wife and live in his attic for several months.",Robin Swicord,2016,"['bryan cranston', ' jennifer garner', ' beverly dangelo', 'jason omara']",['drama']
Deepwater Horizon,"title: Deepwater Horizon ,Description: A dramatization of the April 2010 disaster, when the offshore drilling rig Deepwater Horizon exploded and created the worst oil spill in U.S. history.",Peter Berg,2016,"['mark wahlberg', ' kurt russell', ' douglas m. griffin', ' james dumont']","['action', 'drama', 'thriller']"
The Promise,"title: The Promise ,Description: Set during the last days of the Ottoman Empire, The Promise follows a love triangle between Michael, a brilliant medical student, the beautiful and sophisticated Ana, and Chris - a renowned American journalist based in Paris.",Terry George,2016,"['oscar isaac', ' charlotte le bon', ' christian bale', ' daniel giménez cacho']","['drama', 'history']"
Allied,"title: Allied ,Description: In 1942, a Canadian intelligence officer in North Africa encounters a female French Resistance fighter on a deadly mission behind enemy lines. When they reunite in London, their relationship is tested by the pressures of war.",Robert Zemeckis,2016,"['brad pitt', ' marion cotillard', ' jared harris', ' vincent ebrahim']","['action', 'drama', 'romance']"
A Monster Calls,"title: A Monster Calls ,Description: A boy seeks the help of a tree monster to cope with his single mother's terminal illness.",J.A. Bayona,2016,"['lewis macdougall', ' sigourney weaver', ' felicity jones', 'toby kebbell']","['drama', 'fantasy']"
Collateral Beauty,"title: Collateral Beauty ,Description: Retreating from life after a tragedy, a man questions the universe by writing to Love, Time and Death. Receiving unexpected answers, he begins to see how these things interlock and how even loss can reveal moments of meaning and beauty.",David Frankel,2016,"['will smith', ' edward norton', ' kate winslet', ' michael peña']","['drama', 'romance']"
Zootopia,"title: Zootopia ,Description: In a city of anthropomorphic animals, a rookie bunny cop and a cynical con artist fox must work together to uncover a conspiracy.",Byron Howard,2016,"['ginnifer goodwin', ' jason bateman', ' idris elba', ' jenny slate']","['animation', 'adventure', 'comedy']"
Pirates of the Caribbean: At World's End,"title: Pirates of the Caribbean: At World's End ,Description: Captain Barbossa, Will Turner and Elizabeth Swann must sail off the edge of the map, navigate treachery and betrayal, find Jack Sparrow, and make their final alliances for one last decisive battle.",Gore Verbinski,2007,"['johnny depp', ' orlando bloom', ' keira knightley', 'geoffrey rush']","['action', 'adventure', 'fantasy']"
