title,description,director,year,actors,categories
The Road,"title: The Road ,Description: In a dangerous post-apocalyptic world, an ailing father defends his son as they slowly travel to the sea.",John Hillcoat,2009,"['viggo mortensen', ' charlize theron', ' kodi smit-mcphee', 'robert duvall']","['adventure', 'drama']"
Lavender,"title: Lavender ,Description: After losing her memory, a woman begins to see unexplained things after her psychiatrist suggests she visit her childhood home.",Ed Gass-Donnelly,2016,"['abbie cornish', ' dermot mulroney', ' justin long', 'diego klattenhoff']","['drama', 'thriller']"
Deuces,"title: Deuces ,Description: An agent infiltrates a crime ring ran by a charismatic boss.",Jamal Hill,2016,"['larenz tate', ' meagan good', ' rotimi', ' rick gonzalez']",['drama']
Conan the Barbarian,"title: Conan the Barbarian ,Description: A vengeful barbarian warrior sets off to get his revenge on the evil warlord who attacked his village and murdered his father when he was a boy.",Marcus Nispel,2011,"['jason momoa', ' ron perlman', ' rose mcgowan', 'stephen lang']","['action', 'adventure', 'fantasy']"
The Fighter,"title: The Fighter ,Description: A look at the early years of boxer ""Irish"" Micky Ward and his brother who helped train him before going pro in the mid 1980s.",David O. Russell,2010,"['mark wahlberg', ' christian bale', ' amy adams', 'melissa leo']","['action', 'biography', 'drama']"
August Rush,"title: August Rush ,Description: A drama with fairy tale elements, where an orphaned musical prodigy uses his gift as a clue to finding his birth parents.",Kirsten Sheridan,2007,"['freddie highmore', ' keri russell', ' jonathan rhys meyers', ' terrence howard']","['drama', 'music']"
Chef,"title: Chef ,Description: A head chef quits his restaurant job and buys a food truck in an effort to reclaim his creative promise, while piecing back together his estranged family.",Jon Favreau,2014,"['jon favreau', ' robert downey jr.', ' scarlett johansson', 'dustin hoffman']","['comedy', 'drama']"
Eye in the Sky,"title: Eye in the Sky ,Description: Col. Katherine Powell, a military officer in command of an operation to capture terrorists in Kenya, sees her mission escalate when a girl enters the kill zone triggering an international dispute over the implications of modern warfare.",Gavin Hood,2015,"['helen mirren', ' aaron paul', ' alan rickman', ' barkhad abdi']","['drama', 'thriller', 'war']"
Eagle Eye,"title: Eagle Eye ,Description: Jerry and Rachel are two strangers thrown together by a mysterious phone call from a woman they have never met. Threatening their lives and family, she pushes Jerry and Rachel into a series of increasingly dangerous situations, using the technology of everyday life to track and control their every move.",D.J. Caruso,2008,"['shia labeouf', ' michelle monaghan', ' rosario dawson', 'michael chiklis']","['action', 'mystery', 'thriller']"
The Purge,"title: The Purge ,Description: A wealthy family are held hostage for harboring the target of a murderous syndicate during the Purge, a 12-hour period in which any and all crime is legal.",James DeMonaco,2013,"['ethan hawke', ' lena headey', ' max burkholder', 'adelaide kane']","['horror', 'sci-fi', 'thriller']"
PK,"title: PK ,Description: A stranger in the city asks questions no one has asked before. His childlike curiosity will take him on a journey of love, laughter, and letting go.",Rajkumar Hirani,2014,"['aamir khan', ' anushka sharma', ' sanjay dutt', 'boman irani']","['comedy', 'drama', 'romance']"
Ender's Game,"title: Ender's Game ,Description: Young Ender Wiggin is recruited by the International Military to lead the fight against the Formics, a genocidal alien race which nearly annihilated the human race in a previous invasion.",Gavin Hood,2013,"['harrison ford', ' asa butterfield', ' hailee steinfeld', ' abigail breslin']","['action', 'sci-fi']"
Indiana Jones and the Kingdom of the Crystal Skull,"title: Indiana Jones and the Kingdom of the Crystal Skull ,Description: Famed archaeologist/adventurer Dr. Henry ""Indiana"" Jones is called back into action when he becomes entangled in a Soviet plot to uncover the secret behind mysterious artifacts known as the Crystal Skulls.",Steven Spielberg,2008,"['harrison ford', ' cate blanchett', ' shia labeouf', 'karen allen']","['action', 'adventure', 'fantasy']"
Paper Towns,"title: Paper Towns ,Description: After an all night adventure, Quentin's life-long crush, Margo, disappears, leaving behind clues that Quentin and his friends follow on the journey of a lifetime.",Jake Schreier,2015,"['nat wolff', ' cara delevingne', ' austin abrams', ' justice smith']","['drama', 'mystery', 'romance']"
High-Rise,"title: High-Rise ,Description: Life for the residents of a tower block begins to run out of control.",Ben Wheatley,2015,"['tom hiddleston', ' jeremy irons', ' sienna miller', ' luke evans']",['drama']
Quantum of Solace,"title: Quantum of Solace ,Description: James Bond descends into mystery as he tries to stop a mysterious organization from eliminating a country's most valuable resource. All the while, he still tries to seek revenge over the death of his love.",Marc Forster,2008,"['daniel craig', ' olga kurylenko', ' mathieu amalric', ' judi dench']","['action', 'adventure', 'thriller']"
The Assignment,"title: The Assignment ,Description: After waking up and discovering that he has undergone gender reassignment surgery, an assassin seeks to find the doctor responsible.",Walter Hill,2016,"['sigourney weaver', ' michelle rodriguez', ' tony shalhoub', 'anthony lapaglia']","['action', 'crime', 'thriller']"
How to Train Your Dragon,"title: How to Train Your Dragon ,Description: A hapless young Viking who aspires to hunt dragons becomes the unlikely friend of a young dragon himself, and learns there may be more to the creatures than he assumed.",Dean DeBlois,2010,"['jay baruchel', ' gerard butler', 'christopher mintz-plasse', ' craig ferguson']","['animation', 'action', 'adventure']"
Lady in the Water,"title: Lady in the Water ,Description: Apartment building superintendent Cleveland Heep rescues what he thinks is a young woman from the pool he maintains. When he discovers that she is actually a character from a bedtime story who is trying to make the journey back to her home, he works with his tenants to protect his new friend from the creatures that are determined to keep her in our world.",M. Night Shyamalan,2006,"['paul giamatti', ' bryce dallas howard', ' jeffrey wright', ' bob balaban']","['drama', 'fantasy', 'mystery']"
The Fountain,"title: The Fountain ,Description: As a modern-day scientist, Tommy is struggling with mortality, desperately searching for the medical breakthrough that will save the life of his cancer-stricken wife, Izzi.",Darren Aronofsky,2006,"['hugh jackman', ' rachel weisz', ' sean patrick thomas', ' ellen burstyn']","['drama', 'sci-fi']"
Cars 2,"title: Cars 2 ,Description: Star race car Lightning McQueen and his pal Mater head overseas to compete in the World Grand Prix race. But the road to the championship becomes rocky as Mater gets caught up in an intriguing adventure of his own: international espionage.",John Lasseter,2011,"['owen wilson', ' larry the cable guy', 'michael caine', ' emily mortimer']","['animation', 'adventure', 'comedy']"
31,"title: 31 ,Description: Five carnival workers are kidnapped and held hostage in an abandoned, Hell-like compound where they are forced to participate in a violent game, the goal of which is to survive twelve hours against a gang of sadistic clowns.",Rob Zombie,2016,"['malcolm mcdowell', ' richard brake', ' jeff daniel phillips', 'sheri moon zombie']","['horror', 'thriller']"
Final Girl,"title: Final Girl ,Description: A man teaches a young woman how to become a complete weapon. Later she is approached by a group of sadistic teens who kill blonde women for unknown reasons. The hunting season begins.",Tyler Shields,2015,"['abigail breslin', ' wes bentley', ' logan huffman', 'alexander ludwig']","['action', 'thriller']"
Chalk It Up,"title: Chalk It Up ,Description: When a super girly-girl is dumped by her boyfriend; she decides to do everything she can to get him back by building a college gymnastics team, quickly learning that she is capable of a lot more than just getting an MRS degree.",Hisonni Johnson,2016,"['maddy curley', ' john deluca', ' nikki soohoo', ' drew seeley']",['comedy']
The Man Who Knew Infinity,"title: The Man Who Knew Infinity ,Description: The story of the life and academic career of the pioneer Indian mathematician, Srinivasa Ramanujan, and his friendship with his mentor, Professor G.H. Hardy.",Matt Brown,2015,"['dev patel', ' jeremy irons', ' malcolm sinclair', ' raghuvir joshi']","['biography', 'drama']"
Unknown,"title: Unknown ,Description: A man awakens from a coma, only to discover that someone has taken on his identity and that no one, (not even his wife), believes him. With the help of a young woman, he sets out to prove who he is.",Jaume Collet-Serra,2011,"['liam neeson', ' diane kruger', ' january jones', 'aidan quinn']","['action', 'mystery', 'thriller']"
Self/less,"title: Self/less ,Description: A dying real estate mogul transfers his consciousness into a healthy young body, but soon finds that neither the procedure nor the company that performed it are quite what they seem.",Tarsem Singh,2015,"['ryan reynolds', ' natalie martinez', ' matthew goode', 'ben kingsley']","['action', 'mystery', 'sci-fi']"
Mr. Brooks,"title: Mr. Brooks ,Description: A psychological thriller about a man who is sometimes controlled by his murder-and-mayhem-loving alter ego.",Bruce A. Evans,2007,"['kevin costner', ' demi moore', ' william hurt', ' dane cook']","['crime', 'drama', 'thriller']"
Tramps,"title: Tramps ,Description: A young man and woman find love in an unlikely place while carrying out a shady deal.",Adam Leon,2016,"['callum turner', ' grace van patten', ' michal vondel', ' mike birbiglia']","['comedy', 'romance']"
Before We Go,"title: Before We Go ,Description: Two strangers stuck in Manhattan for the night grow into each other's most trusted confidants when an evening of unexpected adventure forces them to confront their fears and take control of their lives.",Chris Evans,2014,"['chris evans', ' alice eve', ' emma fitzpatrick', ' john cullum']","['comedy', 'drama', 'romance']"
Captain Phillips,"title: Captain Phillips ,Description: The true story of Captain Richard Phillips and the 2009 hijacking by Somali pirates of the U.S.-flagged MV Maersk Alabama, the first American cargo ship to be hijacked in two hundred years.",Paul Greengrass,2013,"['tom hanks', ' barkhad abdi', ' barkhad abdirahman', 'catherine keener']","['biography', 'drama', 'thriller']"
The Secret Scripture,"title: The Secret Scripture ,Description: A woman keeps a diary of her extended stay at a mental hospital.",Jim Sheridan,2016,"['rooney mara', ' eric bana', ' theo james', ' aidan turner']",['drama']
Max Steel,"title: Max Steel ,Description: The adventures of teenager Max McGrath and his alien companion, Steel, who must harness and combine their tremendous new powers to evolve into the turbo-charged superhero Max Steel.",Stewart Hendler,2016,"['ben winchell', ' josh brener', ' maria bello', ' andy garcia']","['action', 'adventure', 'family']"
Hotel Transylvania 2,"title: Hotel Transylvania 2 ,Description: Dracula and his friends try to bring out the monster in his half human, half vampire grandson in order to keep Mavis from leaving the hotel.",Genndy Tartakovsky,2015,"['adam sandler', ' andy samberg', ' selena gomez', ' kevin james']","['animation', 'comedy', 'family']"
Hancock,"title: Hancock ,Description: Hancock is a superhero whose ill considered behavior regularly causes damage in the millions. He changes when the person he saves helps him improve his public image.",Peter Berg,2008,"['will smith', ' charlize theron', ' jason bateman', ' jae head']","['action', 'crime', 'drama']"
Sisters,"title: Sisters ,Description: Two sisters decide to throw one last house party before their parents sell their family home.",Jason Moore,2015,"['amy poehler', ' tina fey', ' maya rudolph', ' ike barinholtz']",['comedy']
The Family,"title: The Family ,Description: The Manzoni family, a notorious mafia clan, is relocated to Normandy, France under the witness protection program, where fitting in soon becomes challenging as their old habits die hard.",Luc Besson,2013,"['robert de niro', ' michelle pfeiffer', ' dianna agron', ' john dleo']","['comedy', 'crime', 'thriller']"
Zack and Miri Make a Porno,"title: Zack and Miri Make a Porno ,Description: Lifelong platonic friends Zack and Miri look to solve their respective cash-flow problems by making an adult film together. As the cameras roll, however, the duo begin to sense that they may have more feelings for each other than they previously thought.",Kevin Smith,2008,"['seth rogen', ' elizabeth banks', ' craig robinson', ' gerry bednob']","['comedy', 'romance']"
Ma vie de Courgette,"title: Ma vie de Courgette ,Description: After losing his mother, a young boy is sent to a foster home with other orphans his age where he begins to learn the meaning of trust and true love.",Claude Barras,2016,"['gaspard schlatter', ' sixtine murat', ' paulin jaccoud', 'michel vuillermoz']","['animation', 'comedy', 'drama']"
Man on a Ledge,"title: Man on a Ledge ,Description: As a police psychologist works to talk down an ex-con who is threatening to jump from a Manhattan hotel rooftop, the biggest diamond heist ever committed is in motion.",Asger Leth,2012,"['sam worthington', ' elizabeth banks', ' jamie bell', ' mandy gonzalez']","['action', 'crime', 'thriller']"
No Strings Attached,"title: No Strings Attached ,Description: A guy and girl try to keep their relationship strictly physical, but it's not long before they learn that they want something more.",Ivan Reitman,2011,"['natalie portman', ' ashton kutcher', ' kevin kline', ' cary elwes']","['comedy', 'romance']"
Rescue Dawn,"title: Rescue Dawn ,Description: A U.S. fighter pilot's epic struggle of survival after being shot down on a mission over Laos during the Vietnam War.",Werner Herzog,2006,"['christian bale', ' steve zahn', ' jeremy davies', ' zach grenier']","['adventure', 'biography', 'drama']"
Despicable Me 2,"title: Despicable Me 2 ,Description: When Gru, the world's most super-bad turned super-dad has been recruited by a team of officials to stop lethal muscle and a host of Gru's own, He has to fight back with new gadgetry, cars, and more minion madness.",Pierre Coffin,2013,"['steve carell', ' kristen wiig', ' benjamin bratt', ' miranda cosgrove']","['animation', 'adventure', 'comedy']"
A Walk Among the Tombstones,"title: A Walk Among the Tombstones ,Description: Private investigator Matthew Scudder is hired by a drug kingpin to find out who kidnapped and murdered his wife.",Scott Frank,2014,"['liam neeson', ' dan stevens', ' david harbour', ' boyd holbrook']","['crime', 'drama', 'mystery']"
The World's End,"title: The World's End ,Description: Five friends who reunite in an attempt to top their epic pub crawl from twenty years earlier unwittingly become humanity's only hope for survival.",Edgar Wright,2013,"['simon pegg', ' nick frost', ' martin freeman', ' rosamund pike']","['action', 'comedy', 'sci-fi']"
Yoga Hosers,"title: Yoga Hosers ,Description: Two teenage yoga enthusiasts team up with a legendary man-hunter to battle with an ancient evil presence that is threatening their major party plans.",Kevin Smith,2016,"['lily-rose depp', ' harley quinn smith', ' johnny depp', 'adam brody']","['comedy', 'fantasy', 'horror']"
Seven Psychopaths,"title: Seven Psychopaths ,Description: A struggling screenwriter inadvertently becomes entangled in the Los Angeles criminal underworld after his oddball friends kidnap a gangster's beloved Shih Tzu.",Martin McDonagh,2012,"['colin farrell', ' woody harrelson', ' sam rockwell', 'christopher walken']","['comedy', 'crime']"
Beowulf,"title: Beowulf ,Description: The warrior Beowulf must fight and defeat the monster Grendel who is terrorizing Denmark, and later, Grendel's mother, who begins killing out of revenge.",Robert Zemeckis,2007,"['ray winstone', ' crispin glover', ' angelina jolie', 'robin wright']","['animation', 'action', 'adventure']"
Jack Ryan: Shadow Recruit,"title: Jack Ryan: Shadow Recruit ,Description: Jack Ryan, as a young covert CIA analyst, uncovers a Russian plot to crash the U.S. economy with a terrorist attack.",Kenneth Branagh,2014,"['chris pine', ' kevin costner', ' keira knightley', 'kenneth branagh']","['action', 'drama', 'thriller']"
1408,"title: 1408 ,Description: A man who specializes in debunking paranormal occurrences checks into the fabled room 1408 in the Dolphin Hotel. Soon after settling in, he confronts genuine terror.",Mikael Håfström,2007,"['john cusack', ' samuel l. jackson', ' mary mccormack', ' paul birchard']","['fantasy', 'horror']"
The Gambler,"title: The Gambler ,Description: Lit professor and gambler Jim Bennett's debt causes him to borrow money from his mother and a loan shark. Further complicating his situation is his relationship with one of his students. Will Bennett risk his life for a second chance?",Rupert Wyatt,2014,"['mark wahlberg', ' jessica lange', ' john goodman', ' brie larson']","['crime', 'drama', 'thriller']"
Prince of Persia: The Sands of Time,"title: Prince of Persia: The Sands of Time ,Description: A young fugitive prince and princess must stop a villain who unknowingly threatens to destroy the world with a special dagger that enables the magic sand inside to reverse time.",Mike Newell,2010,"['jake gyllenhaal', ' gemma arterton', ' ben kingsley', 'alfred molina']","['action', 'adventure', 'fantasy']"
The Spectacular Now,"title: The Spectacular Now ,Description: A hard-partying high school senior's philosophy on life changes when he meets the not-so-typical ""nice girl.""",James Ponsoldt,2013,"['miles teller', ' shailene woodley', ' kyle chandler', 'jennifer jason leigh']","['comedy', 'drama', 'romance']"
A United Kingdom,"title: A United Kingdom ,Description: The story of King Seretse Khama of Botswana and how his loving but controversial marriage to a British white woman, Ruth Williams, put his kingdom into political and diplomatic turmoil.",Amma Asante,2016,"['david oyelowo', ' rosamund pike', ' tom felton', ' jack davenport']","['biography', 'drama', 'romance']"
USS Indianapolis: Men of Courage,"title: USS Indianapolis: Men of Courage ,Description: During World War II, an American navy ship is sunk by a Japanese submarine leaving 300 crewmen stranded in shark infested waters.",Mario Van Peebles,2016,"['nicolas cage', ' tom sizemore', ' thomas jane', 'matt lanter']","['action', 'drama', 'history']"
Turbo Kid,"title: Turbo Kid ,Description: In a post-apocalyptic wasteland in 1997, a comic book fan adopts the persona of his favourite hero to save his enthusiastic friend and fight a tyrannical overlord.",François Simard,2015,"['munro chambers', ' laurence leboeuf', ' michael ironside', ' edwin wright']","['action', 'adventure', 'comedy']"
Mama,"title: Mama ,Description: A young couple take in their two nieces only to suspect that a foreboding evil has latched itself to their family.",Andrés Muschietti,2013,"['jessica chastain', ' nikolaj coster-waldau', ' megan charpentier', ' isabelle nélisse']","['horror', 'thriller']"
Orphan,"title: Orphan ,Description: A husband and wife who recently lost their baby adopt a nine year-old girl who is not nearly as innocent as she claims to be.",Jaume Collet-Serra,2009,"['vera farmiga', ' peter sarsgaard', ' isabelle fuhrman', ' cch pounder']","['horror', 'mystery', 'thriller']"
To Rome with Love,"title: To Rome with Love ,Description: The lives of some visitors and residents of Rome and the romances, adventures and predicaments they get into.",Woody Allen,2012,"['woody allen', ' penélope cruz', ' jesse eisenberg', ' ellen page']","['comedy', 'romance']"
Fantastic Mr. Fox,"title: Fantastic Mr. Fox ,Description: An urbane fox cannot resist returning to his farm raiding ways and then must help his community survive the farmers' retaliation.",Wes Anderson,2009,"['george clooney', ' meryl streep', ' bill murray', ' jason schwartzman']","['animation', 'adventure', 'comedy']"
Inside Man,"title: Inside Man ,Description: A police detective, a bank robber, and a high-power broker enter high-stakes negotiations after the criminal's brilliant heist spirals into a hostage situation.",Spike Lee,2006,"['denzel washington', ' clive owen', ' jodie foster', 'christopher plummer']","['crime', 'drama', 'mystery']"
I.T.,"title: I.T. ,Description: A self-proclaimed millionaire, has his life turned upside down after firing his I.T. consultant.",John Moore,2016,"['pierce brosnan', ' jason barry', ' karen moskow', ' kai ryssdal']","['crime', 'drama', 'mystery']"
127 Hours,"title: 127 Hours ,Description: An adventurous mountain climber becomes trapped under a boulder while canyoneering alone near Moab, Utah and resorts to desperate measures in order to survive.",Danny Boyle,2010,"['james franco', ' amber tamblyn', ' kate mara', ' sean bott']","['adventure', 'biography', 'drama']"
Annabelle,"title: Annabelle ,Description: A couple begins to experience terrifying supernatural occurrences involving a vintage doll shortly after their home is invaded by satanic cultists.",John R. Leonetti,2014,"['ward horton', ' annabelle wallis', ' alfre woodard', 'tony amendola']","['horror', 'mystery', 'thriller']"
Wolves at the Door,"title: Wolves at the Door ,Description: Four friends gather at an elegant home during the Summer of Love, 1969. Unbeknownst to them, deadly visitors are waiting outside. What begins as a simple farewell party turns to a night of ... See full summary »",John R. Leonetti,2016,"['katie cassidy', ' elizabeth henstridge', ' adam campbell', ' miles fisher']","['horror', 'thriller']"
suite francaise,"title: suite francaise ,Description: During the early years of Nazi occupation of France in World War II, romance blooms between Lucile Angellier (Michelle Williams), a French villager, and Bruno von Falk (Matthias Schoenaerts), a German soldier.",Saul Dibb,2014,"['michelle williams', ' kristin scott thomas', ' margot robbie', 'eric godon']","['drama', 'romance', 'war']"
The Imaginarium of Doctor Parnassus,"title: The Imaginarium of Doctor Parnassus ,Description: A traveling theater company gives its audience much more than they were expecting.",Terry Gilliam,2009,"['christopher plummer', ' lily cole', ' heath ledger', 'andrew garfield']","['adventure', 'fantasy', 'mystery']"
G.I. Joe: The Rise of Cobra,"title: G.I. Joe: The Rise of Cobra ,Description: An elite military unit comprised of special operatives known as G.I. Joe, operating out of The Pit, takes on an evil organization led by a notorious arms dealer.",Stephen Sommers,2009,"['dennis quaid', ' channing tatum', ' marlon wayans', 'adewale akinnuoye-agbaje']","['action', 'adventure', 'sci-fi']"
Christine,"title: Christine ,Description: The story of Christine Chubbuck, a 1970s TV reporter struggling with depression and professional frustrations as she tries to advance her career.",Antonio Campos,2016,"['rebecca hall', ' michael c. hall', ' tracy letts', ' maria dizzia']","['biography', 'drama']"
Man Down,"title: Man Down ,Description: In a post-apocalyptic America, former U.S. Marine Gabriel Drummer searches desperately for the whereabouts of his son, accompanied by his best friend and a survivor.",Dito Montiel,2015,"['shia labeouf', ' jai courtney', ' gary oldman', ' kate mara']","['drama', 'thriller']"
Crawlspace,"title: Crawlspace ,Description: A thriller centered around a widower who moves into a seemingly perfect new home with his daughter and new wife.",Phil Claydon,2016,"['michael vartan', ' erin moriarty', ' nadine velazquez', 'ronnie gene blevins']","['horror', 'thriller']"
Shut In,"title: Shut In ,Description: A heart-pounding thriller about a widowed child psychologist who lives in an isolated existence in rural New England. Caught in a deadly winter storm, she must find a way to rescue a young boy before he disappears forever.",Farren Blackburn,2016,"['naomi watts', ' charlie heaton', ' jacob tremblay', 'oliver platt']","['drama', 'horror', 'thriller']"
The Warriors Gate,"title: The Warriors Gate ,Description: A teenager is magically transported to China and learns to convert his video game skills into those of a Kung Fu warrior.",Matthias Hoene,2016,"['mark chao', ' ni ni', ' dave bautista', ' sienna guillory']","['action', 'adventure', 'fantasy']"
Grindhouse,"title: Grindhouse ,Description: Quentin Tarantino and Robert Rodriguez's homage to exploitation double features in the 60s and 70s with two back-to-back cult films that include previews of coming attractions between them.",Robert Rodriguez,2007,"['kurt russell', ' rose mcgowan', ' danny trejo', ' zoë bell']","['action', 'horror', 'thriller']"
Disaster Movie,"title: Disaster Movie ,Description: Over the course of one evening, an unsuspecting group of twenty-somethings find themselves bombarded by a series of natural disasters and catastrophic events.",Jason Friedberg,2008,"['carmen electra', ' vanessa lachey', 'nicole parker', ' matt lanter']",['comedy']
Rocky Balboa,"title: Rocky Balboa ,Description: Thirty years after the ring of the first bell, Rocky Balboa comes out of retirement and dons his gloves for his final fight; against the reigning heavyweight champ Mason 'The Line' Dixon.",Sylvester Stallone,2006,"['sylvester stallone', ' antonio tarver', ' milo ventimiglia', ' burt young']","['drama', 'sport']"
