title,description,director,year,actors,categories
Big Hero 6,"title: Big Hero 6 ,Description: The special bond that develops between plus-sized inflatable robot Baymax, and prodigy Hiro Hamada, who team up with a group of friends to form a band of high-tech heroes.",Don Hall,2014,"['ryan potter', ' scott adsit', ' jamie chung', 't.j. miller']","['animation', 'action', 'adventure']"
Carrie,"title: Carrie ,Description: A shy girl, outcasted by her peers and sheltered by her religious mother, unleashes telekinetic terror on her small town after being pushed too far at her senior prom.",Kimberly Peirce,2013,"['chloë grace moretz', ' julianne moore', ' gabriella wilde', ' portia doubleday']","['drama', 'horror']"
Iron Man 2,"title: Iron Man 2 ,Description: With the world now aware of his identity as Iron Man, Tony Stark must contend with both his declining health and a vengeful mad man with ties to his father's legacy.",Jon Favreau,2010,"['robert downey jr.', ' mickey rourke', ' gwyneth paltrow', 'don cheadle']","['action', 'adventure', 'sci-fi']"
Demolition,"title: Demolition ,Description: A successful investment banker struggles after losing his wife in a tragic car crash. With the help of a customer service rep and her young son, he starts to rebuild, beginning with the demolition of the life he once knew.",Jean-Marc Vallée,2015,"['jake gyllenhaal', ' naomi watts', ' chris cooper', 'judah lewis']","['comedy', 'drama']"
Pandorum,"title: Pandorum ,Description: A pair of crew members aboard a spaceship wake up with no knowledge of their mission or their identities.",Christian Alvart,2009,"['dennis quaid', ' ben foster', ' cam gigandet', ' antje traue']","['action', 'horror', 'mystery']"
Olympus Has Fallen,"title: Olympus Has Fallen ,Description: Disgraced Secret Service agent (and former presidential guard) Mike Banning finds himself trapped inside the White House in the wake of a terrorist attack; using his inside knowledge, Banning works with national security to rescue the President from his kidnappers.",Antoine Fuqua,2013,"['gerard butler', ' aaron eckhart', ' morgan freeman', 'angela bassett']","['action', 'thriller']"
I Am Number Four,"title: I Am Number Four ,Description: Aliens and their Guardians are hiding on Earth from intergalactic bounty hunters. They can only be killed in numerical order, and Number Four is next on the list. This is his story.",D.J. Caruso,2011,"['alex pettyfer', ' timothy olyphant', ' dianna agron', ' teresa palmer']","['action', 'adventure', 'sci-fi']"
Jagten,"title: Jagten ,Description: A teacher lives a lonely life, all the while struggling over his son's custody. His life slowly gets better as he finds love and receives good news from his son, but his new luck is about to be brutally shattered by an innocent little lie.",Thomas Vinterberg,2012,"['mads mikkelsen', ' thomas bo larsen', ' annika wedderkopp', ' lasse fogelstrøm']",['drama']
The Proposal,"title: The Proposal ,Description: A pushy boss forces her young assistant to marry her in order to keep her visa status in the U.S. and avoid deportation to Canada.",Anne Fletcher,2009,"['sandra bullock', ' ryan reynolds', ' mary steenburgen', 'craig t. nelson']","['comedy', 'drama', 'romance']"
Get Hard,"title: Get Hard ,Description: When millionaire James King is jailed for fraud and bound for San Quentin, he turns to Darnell Lewis to prep him to go behind bars.",Etan Cohen,2015,"['will ferrell', ' kevin hart', ' alison brie', ' t.i.']","['comedy', 'crime']"
Just Go with It,"title: Just Go with It ,Description: On a weekend trip to Hawaii, a plastic surgeon convinces his loyal assistant to pose as his soon-to-be-divorced wife in order to cover up a careless lie he told to his much-younger girlfriend.",Dennis Dugan,2011,"['adam sandler', ' jennifer aniston', ' brooklyn decker', 'nicole kidman']","['comedy', 'romance']"
Revolutionary Road,"title: Revolutionary Road ,Description: A young couple living in a Connecticut suburb during the mid-1950s struggle to come to terms with their personal problems while trying to raise their two children.",Sam Mendes,2008,"['leonardo dicaprio', ' kate winslet', ' christopher fitzgerald', ' jonathan roumie']","['drama', 'romance']"
The Town,"title: The Town ,Description: As he plans his next job, a longtime thief tries to balance his feelings for a bank manager connected to one of his earlier heists, as well as the FBI agent looking to bring him and his crew down.",Ben Affleck,2010,"['ben affleck', ' rebecca hall', ' jon hamm', ' jeremy renner']","['crime', 'drama', 'thriller']"
The Boy,"title: The Boy ,Description: An American nanny is shocked that her new English family's boy is actually a life-sized doll. After she violates a list of strict rules, disturbing events make her believe that the doll is really alive.",William Brent Bell,2016,"['lauren cohan', ' rupert evans', ' james russell', ' jim norton']","['horror', 'mystery', 'thriller']"
Denial,"title: Denial ,Description: Acclaimed writer and historian Deborah E. Lipstadt must battle for historical truth to prove the Holocaust actually occurred when David Irving, a renowned denier, sues her for libel.",Mick Jackson,2016,"['rachel weisz', ' tom wilkinson', ' timothy spall', ' andrew scott']","['biography', 'drama']"
Predestination,"title: Predestination ,Description: For his final assignment, a top temporal agent must pursue the one criminal that has eluded him throughout time. The chase turns into a unique, surprising and mind-bending exploration of love, fate, identity and time travel taboos.",Michael Spierig,2014,"['ethan hawke', ' sarah snook', ' noah taylor', ' madeleine west']","['drama', 'mystery', 'sci-fi']"
Goosebumps,"title: Goosebumps ,Description: A teenager teams up with the daughter of young adult horror author R. L. Stine after the writer's imaginary demons are set free on the town of Madison, Delaware.",Rob Letterman,2015,"['jack black', ' dylan minnette', ' odeya rush', ' ryan lee']","['adventure', 'comedy', 'family']"
Sherlock Holmes: A Game of Shadows,"title: Sherlock Holmes: A Game of Shadows ,Description: Sherlock Holmes and his sidekick Dr. Watson join forces to outwit and bring down their fiercest adversary, Professor Moriarty.",Guy Ritchie,2011,"['robert downey jr.', ' jude law', ' jared harris', ' rachel mcadams']","['action', 'adventure', 'crime']"
Salt,"title: Salt ,Description: A CIA agent goes on the run after a defector accuses her of being a Russian spy.",Phillip Noyce,2010,"['angelina jolie', ' liev schreiber', ' chiwetel ejiofor', ' daniel olbrychski']","['action', 'crime', 'mystery']"
Enemy,"title: Enemy ,Description: A man seeks out his exact look-alike after spotting him in a movie.",Denis Villeneuve,2013,"['jake gyllenhaal', ' mélanie laurent', ' sarah gadon', 'isabella rossellini']","['mystery', 'thriller']"
District 9,"title: District 9 ,Description: An extraterrestrial race forced to live in slum-like conditions on Earth suddenly finds a kindred spirit in a government agent who is exposed to their biotechnology.",Neill Blomkamp,2009,"['sharlto copley', ' david james', ' jason cope', ' nathalie boltt']","['action', 'sci-fi', 'thriller']"
The Other Guys,"title: The Other Guys ,Description: Two mismatched New York City detectives seize an opportunity to step up like the city's top cops whom they idolize -- only things don't quite go as planned.",Adam McKay,2010,"['will ferrell', ' mark wahlberg', ' derek jeter', ' eva mendes']","['action', 'comedy', 'crime']"
American Gangster,"title: American Gangster ,Description: In 1970s America, a detective works to bring down the drug empire of Frank Lucas, a heroin kingpin from Manhattan, who is smuggling the drug into the country from the Far East.",Ridley Scott,2007,"['denzel washington', ' russell crowe', ' chiwetel ejiofor', 'josh brolin']","['biography', 'crime', 'drama']"
Marie Antoinette,"title: Marie Antoinette ,Description: The retelling of France's iconic but ill-fated queen, Marie Antoinette. From her betrothal and marriage to Louis XVI at 15 to her reign as queen at 19 and to the end of her reign as queen, and ultimately the fall of Versailles.",Sofia Coppola,2006,"['kirsten dunst', ' jason schwartzman', ' rip torn', ' judy davis']","['biography', 'drama', 'history']"
2012,"title: 2012 ,Description: A frustrated writer struggles to keep his family alive when a series of global catastrophes threatens to annihilate mankind.",Roland Emmerich,2009,"['john cusack', ' thandie newton', ' chiwetel ejiofor', 'amanda peet']","['action', 'adventure', 'sci-fi']"
Harry Potter and the Half-Blood Prince,"title: Harry Potter and the Half-Blood Prince ,Description: As Harry Potter begins his sixth year at Hogwarts, he discovers an old book marked as ""the property of the Half-Blood Prince"" and begins to learn more about Lord Voldemort's dark past.",David Yates,2009,"['daniel radcliffe', ' emma watson', ' rupert grint', ' michael gambon']","['adventure', 'family', 'fantasy']"
Argo,"title: Argo ,Description: Acting under the cover of a Hollywood producer scouting a location for a science fiction film, a CIA agent launches a dangerous operation to rescue six Americans in Tehran during the U.S. hostage crisis in Iran in 1980.",Ben Affleck,2012,"['ben affleck', ' bryan cranston', ' john goodman', ' alan arkin']","['biography', 'drama', 'history']"
Eddie the Eagle,"title: Eddie the Eagle ,Description: The story of Eddie Edwards, the notoriously tenacious British underdog ski jumper who charmed the world at the 1988 Winter Olympics.",Dexter Fletcher,2016,"['taron egerton', ' hugh jackman', ' tom costello', ' jo hartley']","['biography', 'comedy', 'drama']"
The Lives of Others,"title: The Lives of Others ,Description: In 1984 East Berlin, an agent of the secret police, conducting surveillance on a writer and his lover, finds himself becoming increasingly absorbed by their lives.",Florian Henckel von Donnersmarck,2006,"['ulrich mühe', ' martina gedeck', 'sebastian koch', ' ulrich tukur']","['drama', 'thriller']"
Pet,"title: Pet ,Description: A psychological thriller about a man who bumps into an old crush and subsequently becomes obsessed with her, leading him to hold her captive underneath the animal shelter where he works. ... See full summary »",Carles Torrens,2016,"['dominic monaghan', ' ksenia solo', ' jennette mccurdy', 'davone mcdonald']","['horror', 'thriller']"
Paint It Black,"title: Paint It Black ,Description: A young woman attempts to deal with the death of her boyfriend while continuously confronted by his mentally unstable mother.",Amber Tamblyn,2016,"['alia shawkat', ' nancy kwan', ' annabelle attanasio', 'alfred molina']",['drama']
Macbeth,"title: Macbeth ,Description: Macbeth, the Thane of Glamis, receives a prophecy from a trio of witches that one day he will become King of Scotland. Consumed by ambition and spurred to action by his wife, Macbeth murders his king and takes the throne for himself.",Justin Kurzel,2015,"['michael fassbender', ' marion cotillard', ' jack madigan', 'frank madigan']","['drama', 'war']"
Forgetting Sarah Marshall,"title: Forgetting Sarah Marshall ,Description: Devastated Peter takes a Hawaiian vacation in order to deal with the recent break-up with his TV star girlfriend, Sarah. Little does he know, Sarah's traveling to the same resort as her ex - and she's bringing along her new boyfriend.",Nicholas Stoller,2008,"['kristen bell', ' jason segel', ' paul rudd', ' mila kunis']","['comedy', 'drama', 'romance']"
The Giver,"title: The Giver ,Description: In a seemingly perfect community, without war, pain, suffering, differences or choice, a young boy is chosen to learn from an elderly man about the true pain and pleasure of the ""real"" world.",Phillip Noyce,2014,"['brenton thwaites', ' jeff bridges', ' meryl streep', ' taylor swift']","['drama', 'romance', 'sci-fi']"
Triple 9,"title: Triple 9 ,Description: A gang of criminals and corrupt cops plan the murder of a police officer in order to pull off their biggest heist yet across town.",John Hillcoat,2016,"['casey affleck', ' chiwetel ejiofor', ' anthony mackie', 'aaron paul']","['action', 'crime', 'drama']"
Perfetti sconosciuti,"title: Perfetti sconosciuti ,Description: Seven long-time friends get together for a dinner. When they decide to share with each other the content of every text message, email and phone call they receive, many secrets start to unveil and the equilibrium trembles.",Paolo Genovese,2016,"['giuseppe battiston', ' anna foglietta', ' marco giallini', 'edoardo leo']","['comedy', 'drama']"
Angry Birds,"title: Angry Birds ,Description: Find out why the birds are so angry. When an island populated by happy, flightless birds is visited by mysterious green piggies, it's up to three unlikely outcasts - Red, Chuck and Bomb - to figure out what the pigs are up to.",Clay Kaytis,2016,"['jason sudeikis', ' josh gad', ' danny mcbride', ' maya rudolph']","['animation', 'action', 'adventure']"
Moonrise Kingdom,"title: Moonrise Kingdom ,Description: A pair of young lovers flee their New England town, which causes a local search party to fan out to find them.",Wes Anderson,2012,"['jared gilman', ' kara hayward', ' bruce willis', ' bill murray']","['adventure', 'comedy', 'drama']"
Hairspray,"title: Hairspray ,Description: Pleasantly plump teenager Tracy Turnblad teaches 1962 Baltimore a thing or two about integration after landing a spot on a local TV dance show.",Adam Shankman,2007,"['john travolta', ' queen latifah', ' nikki blonsky', 'michelle pfeiffer']","['comedy', 'drama', 'family']"
Safe Haven,"title: Safe Haven ,Description: A young woman with a mysterious past lands in Southport, North Carolina where her bond with a widower forces her to confront the dark secret that haunts her.",Lasse Hallström,2013,"['julianne hough', ' josh duhamel', ' cobie smulders', 'david lyons']","['drama', 'romance', 'thriller']"
Focus,"title: Focus ,Description: In the midst of veteran con man Nicky's latest scheme, a woman from his past - now an accomplished femme fatale - shows up and throws his plans for a loop.",Glenn Ficarra,2015,"['will smith', ' margot robbie', ' rodrigo santoro', ' adrian martinez']","['comedy', 'crime', 'drama']"
Ratatouille,"title: Ratatouille ,Description: A rat who can cook makes an unusual alliance with a young kitchen worker at a famous restaurant.",Brad Bird,2007,"['brad garrett', ' lou romano', ' patton oswalt', 'ian holm']","['animation', 'comedy', 'family']"
Stake Land,"title: Stake Land ,Description: Martin was a normal teenage boy before the country collapsed in an empty pit of economic and political disaster. A vampire epidemic has swept across what is left of the nation's abandoned ... See full summary »",Jim Mickle,2010,"['connor paolo', ' nick damici', ' kelly mcgillis', ' gregory jones']","['drama', 'horror', 'sci-fi']"
The Book of Eli,"title: The Book of Eli ,Description: A post-apocalyptic tale, in which a lone man fights his way across America in order to protect a sacred book that holds the secrets to saving humankind.",Albert Hughes,2010,"['denzel washington', ' mila kunis', ' ray stevenson', ' gary oldman']","['action', 'adventure', 'drama']"
Cloverfield,"title: Cloverfield ,Description: A group of friends venture deep into the streets of New York on a rescue mission during a rampaging monster attack.",Matt Reeves,2008,"['mike vogel', ' jessica lucas', ' lizzy caplan', ' t.j. miller']","['action', 'horror', 'sci-fi']"
Point Break,"title: Point Break ,Description: A young FBI agent infiltrates an extraordinary team of extreme sports athletes he suspects of masterminding a string of unprecedented, sophisticated corporate heists.",Ericson Core,2015,"['edgar ramírez', ' luke bracey', ' ray winstone', ' teresa palmer']","['action', 'crime', 'sport']"
Under the Skin,"title: Under the Skin ,Description: A mysterious young woman seduces lonely men in the evening hours in Scotland. However, events lead her to begin a process of self-discovery.",Jonathan Glazer,2013,"['scarlett johansson', ' jeremy mcwilliams', ' lynsey taylor mackay', ' dougie mcconnell']","['drama', 'horror', 'sci-fi']"
I Am Legend,"title: I Am Legend ,Description: Years after a plague kills most of humanity and transforms the rest into monsters, the sole survivor in New York City struggles valiantly to find a cure.",Francis Lawrence,2007,"['will smith', ' alice braga', ' charlie tahan', ' salli richardson-whitfield']","['drama', 'horror', 'sci-fi']"
Men in Black 3,"title: Men in Black 3 ,Description: Agent J travels in time to M.I.B.'s early days in 1969 to stop an alien from assassinating his friend Agent K and changing history.",Barry Sonnenfeld,2012,"['will smith', ' tommy lee jones', ' josh brolin', 'jemaine clement']","['action', 'adventure', 'comedy']"
Super 8,"title: Super 8 ,Description: During the summer of 1979, a group of friends witness a train crash and investigate subsequent unexplained events in their small town.",J.J. Abrams,2011,"['elle fanning', ' aj michalka', ' kyle chandler', ' joel courtney']","['mystery', 'sci-fi', 'thriller']"
Law Abiding Citizen,"title: Law Abiding Citizen ,Description: A frustrated man decides to take justice into his own hands after a plea bargain sets one of his family's killers free. He targets not only the killer but also the district attorney and others involved in the deal.",F. Gary Gray,2009,"['gerard butler', ' jamie foxx', ' leslie bibb', ' colm meaney']","['crime', 'drama', 'thriller']"
Up,"title: Up ,Description: Seventy-eight year old Carl Fredricksen travels to Paradise Falls in his home equipped with balloons, inadvertently taking a young stowaway.",Pete Docter,2009,"['edward asner', ' jordan nagai', ' john ratzenberger', ' christopher plummer']","['animation', 'adventure', 'comedy']"
Maze Runner: The Scorch Trials,"title: Maze Runner: The Scorch Trials ,Description: After having escaped the Maze, the Gladers now face a new set of challenges on the open roads of a desolate landscape filled with unimaginable obstacles.",Wes Ball,2015,"['dylan obrien', ' kaya scodelario', ' thomas brodie-sangster', 'giancarlo esposito']","['action', 'sci-fi', 'thriller']"
Carol,"title: Carol ,Description: An aspiring photographer develops an intimate relationship with an older woman in 1950s New York.",Todd Haynes,2015,"['cate blanchett', ' rooney mara', ' sarah paulson', ' kyle chandler']","['drama', 'romance']"
Imperium,"title: Imperium ,Description: A young FBI agent, eager to prove himself in the field, goes undercover as a white supremacist.",Daniel Ragussis,2016,"['daniel radcliffe', ' toni collette', ' tracy letts', ' sam trammell']","['crime', 'drama', 'thriller']"
Youth,"title: Youth ,Description: A retired orchestra conductor is on holiday with his daughter and his film director best friend in the Alps when he receives an invitation from Queen Elizabeth II to perform for Prince Philip's birthday.",Paolo Sorrentino,2015,"['michael caine', ' harvey keitel', ' rachel weisz', ' jane fonda']","['comedy', 'drama', 'music']"
Mr. Nobody,"title: Mr. Nobody ,Description: A boy stands on a station platform as a train is about to leave. Should he go with his mother or stay with his father? Infinite possibilities arise from this decision. As long as he doesn't choose, anything is possible.",Jaco Van Dormael,2009,"['jared leto', ' sarah polley', ' diane kruger', ' linh dan pham']","['drama', 'fantasy', 'romance']"
City of Tiny Lights,"title: City of Tiny Lights ,Description: In the teeming, multicultural metropolis of modern-day London, a seemingly straightforward missing-person case launches a down-at-heel private eye into a dangerous world of religious fanaticism and political intrigue.",Pete Travis,2016,"['riz ahmed', ' billie piper', ' james floyd', ' cush jumbo']","['crime', 'drama', 'thriller']"
Savages,"title: Savages ,Description: Pot growers Ben and Chon face off against the Mexican drug cartel who kidnapped their shared girlfriend.",Oliver Stone,2012,"['aaron taylor-johnson', ' taylor kitsch', ' blake lively', 'benicio del toro']","['crime', 'drama', 'thriller']"
(500) Days of Summer,"title: (500) Days of Summer ,Description: An offbeat romantic comedy about a woman who doesn't believe true love exists, and the young man who falls for her.",Marc Webb,2009,"['zooey deschanel', ' joseph gordon-levitt', ' geoffrey arend', ' chloë grace moretz']","['comedy', 'drama', 'romance']"
Movie 43,"title: Movie 43 ,Description: A series of interconnected short films follows a washed-up producer as he pitches insane story lines featuring some of the biggest stars in Hollywood.",Elizabeth Banks,2013,"['emma stone', ' stephen merchant', ' richard gere', ' liev schreiber']","['comedy', 'romance']"
Gravity,"title: Gravity ,Description: Two astronauts work together to survive after an accident which leaves them alone in space.",Alfonso Cuarón,2013,"['sandra bullock', ' george clooney', ' ed harris', ' orto ignatiussen']","['drama', 'sci-fi', 'thriller']"
The Boy in the Striped Pyjamas,"title: The Boy in the Striped Pyjamas ,Description: Set during WWII, a story seen through the innocent eyes of Bruno, the eight-year-old son of the commandant at a German concentration camp, whose forbidden friendship with a Jewish boy on the other side of the camp fence has startling and unexpected consequences.",Mark Herman,2008,"['asa butterfield', ' david thewlis', ' rupert friend', ' zac mattoon obrien']","['drama', 'war']"
Shooter,"title: Shooter ,Description: A marksman living in exile is coaxed back into action after learning of a plot to kill the President. Ultimately double-crossed and framed for the attempt, he goes on the run to find the real killer and the reason he was set up.",Antoine Fuqua,2007,"['mark wahlberg', ' michael peña', ' rhona mitra', ' danny glover']","['action', 'crime', 'drama']"
The Happening,"title: The Happening ,Description: A science teacher, his wife, and a young girl struggle to survive a plague that causes those infected to commit suicide.",M. Night Shyamalan,2008,"['mark wahlberg', ' zooey deschanel', ' john leguizamo', ' ashlyn sanchez']","['sci-fi', 'thriller']"
Bone Tomahawk,"title: Bone Tomahawk ,Description: Four men set out in the Wild West to rescue a group of captives from cannibalistic cave dwellers.",S. Craig Zahler,2015,"['kurt russell', ' patrick wilson', ' matthew fox', ' richard jenkins']","['adventure', 'drama', 'horror']"
Magic Mike XXL,"title: Magic Mike XXL ,Description: Three years after Mike bowed out of the stripper life at the top of his game, he and the remaining Kings of Tampa hit the road to Myrtle Beach to put on one last blow-out performance.",Gregory Jacobs,2015,"['channing tatum', ' joe manganiello', ' matt bomer', 'adam rodriguez']","['comedy', 'drama', 'music']"
Easy A,"title: Easy A ,Description: A clean-cut high school student relies on the school's rumor mill to advance her social and financial standing.",Will Gluck,2010,"['emma stone', ' amanda bynes', ' penn badgley', ' dan byrd']","['comedy', 'drama', 'romance']"
Exodus: Gods and Kings,"title: Exodus: Gods and Kings ,Description: The defiant leader Moses rises up against the Egyptian Pharaoh Ramses, setting 600,000 slaves on a monumental journey of escape from Egypt and its terrifying cycle of deadly plagues.",Ridley Scott,2014,"['christian bale', ' joel edgerton', ' ben kingsley', ' sigourney weaver']","['action', 'adventure', 'drama']"
Chappie,"title: Chappie ,Description: In the near future, crime is patrolled by a mechanized police force. When one police droid, Chappie, is stolen and given new programming, he becomes the first robot with the ability to think and feel for himself.",Neill Blomkamp,2015,"['sharlto copley', ' dev patel', ' hugh jackman', 'sigourney weaver']","['action', 'crime', 'drama']"
The Hobbit: The Desolation of Smaug,"title: The Hobbit: The Desolation of Smaug ,Description: The dwarves, along with Bilbo Baggins and Gandalf the Grey, continue their quest to reclaim Erebor, their homeland, from Smaug. Bilbo Baggins is in possession of a mysterious and magical ring.",Peter Jackson,2013,"['ian mckellen', ' martin freeman', ' richard armitage', 'ken stott']","['adventure', 'fantasy']"
Half of a Yellow Sun,"title: Half of a Yellow Sun ,Description: Sisters Olanna and Kainene return home to 1960s Nigeria, where they soon diverge on different paths. As civil war breaks out, political events loom larger than their differences as they join the fight to establish an independent republic.",Biyi Bandele,2013,"['chiwetel ejiofor', ' thandie newton', ' anika noni rose', 'joseph mawle']","['drama', 'romance']"
Anthropoid,"title: Anthropoid ,Description: Based on the extraordinary true story of Operation Anthropoid, the WWII mission to assassinate SS General Reinhard Heydrich, the main architect behind the Final Solution and the Reich's third in command after Hitler and Himmler.",Sean Ellis,2016,"['jamie dornan', ' cillian murphy', ' brian caspe', ' karel hermánek jr.']","['biography', 'history', 'thriller']"
The Counselor,"title: The Counselor ,Description: A lawyer finds himself in over his head when he gets involved in drug trafficking.",Ridley Scott,2013,"['michael fassbender', ' penélope cruz', ' cameron diaz', 'javier bardem']","['crime', 'drama', 'thriller']"
Viking,"title: Viking ,Description: Kievan Rus, late 10th century. After the death of his father, the young Viking prince Vladimir of Novgorod is forced into exile across the frozen sea.",Andrey Kravchuk,2016,"['anton adasinsky', ' aleksandr armer', ' vilen babichev', ' rostislav bershauer']","['action', 'drama', 'history']"
Whiskey Tango Foxtrot,"title: Whiskey Tango Foxtrot ,Description: A journalist recounts her wartime coverage in Afghanistan.",Glenn Ficarra,2016,"['tina fey', ' margot robbie', ' martin freeman', ' alfred molina']","['biography', 'comedy', 'drama']"
